{
  "id": "WF-123",
  "origin_id": "WF-122",
  "correlation_id": "COR-ABC-789",
  "author_role": "Planner",
  "status": "Completed",
  "session_id": "sesh-uuid-8888",
  "artifacts": [
    {
      "path": "agent-output/planning/001-standardized-handoff-schema.md",
      "hash": "e3b0c44298fc1c149afbf4c8996fb92427ae41e4649b934ca495991b7852b855",
      "planka_task_id": "123456789"
    }
  ]
}
